{
  "authored": false,
  "bywayId": "rogue-coquille-scenic-byway-64107",
  "title": "Rogue-Coquille Scenic Byway",
  "longitude": -124.1058,
  "ground": "river-valley",
  "palette": "river",
  "snowInWinter": false,
  "road": {
    "shape": "from-geometry",
    "profile": "valley-floor",
    "lanes": 2,
    "coordinates": [
      [
        -124.18831,
        43.17403
      ],
      [
        -124.17637,
        43.15641
      ],
      [
        -124.17414,
        43.12075
      ],
      [
        -124.14329,
        43.0889
      ],
      [
        -124.13931,
        43.06034
      ],
      [
        -124.11222,
        43.03217
      ],
      [
        -124.14659,
        43.00931
      ],
      [
        -124.13844,
        42.9971
      ],
      [
        -124.14333,
        42.98791
      ],
      [
        -124.15901,
        42.98948
      ],
      [
        -124.13172,
        42.96715
      ],
      [
        -124.11415,
        42.97139
      ],
      [
        -124.10656,
        42.94946
      ],
      [
        -124.0971,
        42.95104
      ],
      [
        -124.09549,
        42.94484
      ],
      [
        -124.11849,
        42.91832
      ],
      [
        -124.10176,
        42.91711
      ],
      [
        -124.10853,
        42.90772
      ],
      [
        -124.10372,
        42.90304
      ],
      [
        -124.07745,
        42.89596
      ],
      [
        -124.07248,
        42.87943
      ],
      [
        -124.05731,
        42.8743
      ],
      [
        -124.0455,
        42.8594
      ],
      [
        -124.03523,
        42.83496
      ],
      [
        -124.01297,
        42.82334
      ],
      [
        -124.01721,
        42.78937
      ],
      [
        -124.05687,
        42.78376
      ],
      [
        -124.06676,
        42.77582
      ],
      [
        -124.06849,
        42.76047
      ],
      [
        -124.05983,
        42.74165
      ],
      [
        -124.036,
        42.71945
      ],
      [
        -124.0597,
        42.70687
      ],
      [
        -124.06246,
        42.69494
      ],
      [
        -124.07095,
        42.69211
      ],
      [
        -124.06818,
        42.68553
      ],
      [
        -124.10396,
        42.66724
      ],
      [
        -124.10482,
        42.6515
      ],
      [
        -124.06878,
        42.62809
      ],
      [
        -124.06785,
        42.62026
      ],
      [
        -124.07971,
        42.61065
      ],
      [
        -124.06881,
        42.61171
      ],
      [
        -124.05899,
        42.58126
      ],
      [
        -124.04884,
        42.57168
      ],
      [
        -124.06379,
        42.54972
      ],
      [
        -124.09421,
        42.55797
      ],
      [
        -124.1208,
        42.55019
      ],
      [
        -124.13387,
        42.53203
      ],
      [
        -124.18979,
        42.49983
      ],
      [
        -124.19403,
        42.48659
      ],
      [
        -124.29632,
        42.50073
      ],
      [
        -124.30951,
        42.48005
      ],
      [
        -124.32413,
        42.48056
      ],
      [
        -124.34622,
        42.46431
      ],
      [
        -124.36761,
        42.46241
      ],
      [
        -124.37692,
        42.43677
      ],
      [
        -124.41299,
        42.42381
      ]
    ],
    "elevation": [
      [
        0,
        0.2
      ],
      [
        0.125,
        0.218
      ],
      [
        0.25,
        0.26
      ],
      [
        0.375,
        0.302
      ],
      [
        0.5,
        0.32
      ],
      [
        0.625,
        0.302
      ],
      [
        0.75,
        0.26
      ],
      [
        0.875,
        0.218
      ],
      [
        1,
        0.2
      ]
    ]
  },
  "landmarks": [
    {
      "name": "Powers",
      "model": "town-blocks",
      "at": 0.321449524476997,
      "offset": "roadside",
      "notes": "Story moment 1; town. Projected coordinate, kept in driving order."
    },
    {
      "name": "Illahe",
      "model": "town-blocks",
      "at": 0.6278736202230375,
      "offset": "roadside",
      "notes": "Story moment 2; town. Projected coordinate, kept in driving order."
    },
    {
      "name": "Agness",
      "model": "town-blocks",
      "at": 0.7155542945739288,
      "offset": "roadside",
      "notes": "Story moment 3; town. Projected coordinate, kept in driving order."
    }
  ],
  "dressing": [
    {
      "model": "conifer",
      "at": 0.0875,
      "side": -1,
      "distance": 0.8,
      "scale": 1.05
    },
    {
      "model": "conifer",
      "at": 0.09949999999999999,
      "side": -1,
      "distance": 1.15,
      "scale": 1.05
    },
    {
      "model": "conifer",
      "at": 0.11149999999999999,
      "side": -1,
      "distance": 1.5,
      "scale": 1.05
    },
    {
      "model": "conifer",
      "at": 0.3375,
      "side": 1,
      "distance": 0.8,
      "scale": 1.05
    },
    {
      "model": "conifer",
      "at": 0.34950000000000003,
      "side": 1,
      "distance": 1.15,
      "scale": 1.05
    },
    {
      "model": "conifer",
      "at": 0.36150000000000004,
      "side": 1,
      "distance": 1.5,
      "scale": 1.05
    },
    {
      "model": "conifer",
      "at": 0.5875,
      "side": -1,
      "distance": 0.8,
      "scale": 1.05
    },
    {
      "model": "conifer",
      "at": 0.5995,
      "side": -1,
      "distance": 1.15,
      "scale": 1.05
    },
    {
      "model": "conifer",
      "at": 0.6115,
      "side": -1,
      "distance": 1.5,
      "scale": 1.05
    },
    {
      "model": "conifer",
      "at": 0.8375,
      "side": 1,
      "distance": 0.8,
      "scale": 1.05
    },
    {
      "model": "conifer",
      "at": 0.8495,
      "side": 1,
      "distance": 1.15,
      "scale": 1.05
    },
    {
      "model": "conifer",
      "at": 0.8615,
      "side": 1,
      "distance": 1.5,
      "scale": 1.05
    },
    {
      "model": "river",
      "at": 0.5,
      "side": 1,
      "distance": 0.8,
      "scale": 1
    }
  ],
  "towns": [
    {
      "name": "Coquille",
      "at": 0,
      "landmark": ""
    },
    {
      "name": "Myrtle Point",
      "at": 0.09890829694323146,
      "landmark": ""
    },
    {
      "name": "Gaylord",
      "at": 0.22903930131004369,
      "landmark": ""
    },
    {
      "name": "Powers",
      "at": 0.3212882096069869,
      "landmark": "Powers"
    },
    {
      "name": "Illahe",
      "at": 0.6275109170305677,
      "landmark": "Illahe"
    },
    {
      "name": "Agness",
      "at": 0.7151746724890831,
      "landmark": "Agness"
    },
    {
      "name": "Wedderburn",
      "at": 0.9994541484716157,
      "landmark": ""
    }
  ],
  "sources": [
    "content/stories/rogue-coquille-scenic-byway-64107.json",
    "public/data/strips/rogue-coquille-scenic-byway-64107.json",
    "public/data/byways.geojson",
    "public/data/catalog.json"
  ],
  "geometryNotes": "Strip main route, simplified to 56 bends. Elevation is a smooth illustrative scene profile, not surveyed heights. Terrain, vegetation and water are schematic; only editorial evidence authorizes landmarks."
}
