{
  "authored": false,
  "bywayId": "cranberry-coast-scenic-byway-54778",
  "title": "Cranberry Coast Scenic Byway",
  "longitude": -123.9914,
  "ground": "coastal-cliff",
  "palette": "coast",
  "snowInWinter": false,
  "road": {
    "shape": "from-geometry",
    "profile": "cliff-shelf",
    "lanes": 2,
    "coordinates": [
      [
        -124.09323,
        46.81
      ],
      [
        -124.09385,
        46.80994
      ],
      [
        -124.09637,
        46.81803
      ],
      [
        -124.09626,
        46.82076
      ],
      [
        -124.09786,
        46.82752
      ],
      [
        -124.09909,
        46.83117
      ],
      [
        -124.10605,
        46.84871
      ],
      [
        -124.10668,
        46.85181
      ],
      [
        -124.1091,
        46.85883
      ],
      [
        -124.08251,
        46.85884
      ],
      [
        -124.06004,
        46.86472
      ],
      [
        -124.05831,
        46.86564
      ],
      [
        -124.05391,
        46.86904
      ],
      [
        -124.05293,
        46.86995
      ],
      [
        -124.05198,
        46.87126
      ],
      [
        -124.05131,
        46.87286
      ],
      [
        -124.0466,
        46.8901
      ],
      [
        -124.04582,
        46.89128
      ],
      [
        -124.04492,
        46.89195
      ],
      [
        -124.04311,
        46.89264
      ],
      [
        -124.04034,
        46.89281
      ],
      [
        -124.02016,
        46.89273
      ],
      [
        -124.01505,
        46.89199
      ],
      [
        -124.00448,
        46.89195
      ],
      [
        -124.00376,
        46.89215
      ],
      [
        -124.00256,
        46.89277
      ],
      [
        -124.00177,
        46.89356
      ],
      [
        -123.99944,
        46.89956
      ],
      [
        -123.99819,
        46.9021
      ],
      [
        -123.99133,
        46.90873
      ],
      [
        -123.98931,
        46.90978
      ],
      [
        -123.97018,
        46.9149
      ],
      [
        -123.96112,
        46.91677
      ],
      [
        -123.95191,
        46.9198
      ],
      [
        -123.93692,
        46.92291
      ],
      [
        -123.9344,
        46.92393
      ],
      [
        -123.92833,
        46.92775
      ],
      [
        -123.91999,
        46.93108
      ],
      [
        -123.8747,
        46.94065
      ],
      [
        -123.87243,
        46.94129
      ],
      [
        -123.86884,
        46.94294
      ],
      [
        -123.8675,
        46.94332
      ],
      [
        -123.84769,
        46.9436
      ],
      [
        -123.84613,
        46.94406
      ],
      [
        -123.83386,
        46.94929
      ],
      [
        -123.82635,
        46.95156
      ],
      [
        -123.8235,
        46.95173
      ],
      [
        -123.81386,
        46.95164
      ],
      [
        -123.81222,
        46.95199
      ],
      [
        -123.80912,
        46.95323
      ],
      [
        -123.80749,
        46.95433
      ],
      [
        -123.80249,
        46.96204
      ],
      [
        -123.80229,
        46.96363
      ],
      [
        -123.80234,
        46.96941
      ],
      [
        -123.81141,
        46.97335
      ],
      [
        -123.81403,
        46.97413
      ]
    ],
    "elevation": [
      [
        0,
        0.85
      ],
      [
        0.125,
        0.894
      ],
      [
        0.25,
        1
      ],
      [
        0.375,
        1.106
      ],
      [
        0.5,
        1.15
      ],
      [
        0.625,
        1.106
      ],
      [
        0.75,
        1
      ],
      [
        0.875,
        0.894
      ],
      [
        1,
        0.85
      ]
    ]
  },
  "landmarks": [
    {
      "name": "Grays Harbor Lighthouse",
      "model": "lighthouse-on-rock",
      "at": 0.15605182656439565,
      "offset": "roadside",
      "notes": "Story moment 1; separate excursion. Projected coordinate, kept in driving order."
    }
  ],
  "dressing": [
    {
      "model": "sandbar",
      "at": 0.041666666666666664,
      "side": 1,
      "distance": 1.5,
      "scale": 1.4
    },
    {
      "model": "sandbar",
      "at": 0.2916666666666667,
      "side": 1,
      "distance": 1.5,
      "scale": 1.4
    },
    {
      "model": "sandbar",
      "at": 0.5416666666666666,
      "side": 1,
      "distance": 1.5,
      "scale": 1.4
    },
    {
      "model": "sandbar",
      "at": 0.7916666666666666,
      "side": 1,
      "distance": 1.5,
      "scale": 1.4
    }
  ],
  "towns": [
    {
      "name": "Grayland",
      "at": 0.06071428571428572,
      "landmark": ""
    },
    {
      "name": "Bay City",
      "at": 0.26339285714285715,
      "landmark": ""
    },
    {
      "name": "Markham",
      "at": 0.503125,
      "landmark": ""
    },
    {
      "name": "Aberdeen",
      "at": 0.9316964285714286,
      "landmark": ""
    }
  ],
  "sources": [
    "content/stories/cranberry-coast-scenic-byway-54778.json",
    "public/data/strips/cranberry-coast-scenic-byway-54778.json",
    "public/data/byways.geojson",
    "public/data/catalog.json"
  ],
  "geometryNotes": "Strip main route, simplified to 56 bends. Elevation is a smooth illustrative scene profile, not surveyed heights. Terrain, vegetation and water are schematic; only editorial evidence authorizes landmarks."
}
