{
  "authored": false,
  "bywayId": "beach-boulevard-scenic-byway-81464",
  "title": "Beach Boulevard Scenic Byway",
  "longitude": -89.3547,
  "ground": "low-shore",
  "palette": "coast",
  "snowInWinter": false,
  "road": {
    "shape": "from-geometry",
    "profile": "rolling",
    "lanes": 2,
    "coordinates": [
      [
        -89.35489,
        30.33905
      ],
      [
        -89.35413,
        30.33938
      ],
      [
        -89.35326,
        30.34024
      ],
      [
        -89.35273,
        30.34058
      ],
      [
        -89.34698,
        30.34297
      ],
      [
        -89.34555,
        30.34335
      ],
      [
        -89.34416,
        30.3434
      ],
      [
        -89.33984,
        30.34295
      ],
      [
        -89.33895,
        30.34262
      ],
      [
        -89.33832,
        30.34217
      ],
      [
        -89.33505,
        30.33894
      ],
      [
        -89.33257,
        30.3376
      ],
      [
        -89.33235,
        30.33724
      ],
      [
        -89.33152,
        30.33444
      ],
      [
        -89.33089,
        30.3331
      ],
      [
        -89.33056,
        30.32868
      ],
      [
        -89.32992,
        30.32678
      ],
      [
        -89.32851,
        30.32463
      ],
      [
        -89.32694,
        30.32344
      ],
      [
        -89.32393,
        30.32008
      ],
      [
        -89.32353,
        30.31938
      ],
      [
        -89.32311,
        30.31783
      ],
      [
        -89.32338,
        30.31531
      ],
      [
        -89.32398,
        30.31292
      ],
      [
        -89.32432,
        30.31224
      ],
      [
        -89.32627,
        30.30947
      ],
      [
        -89.32784,
        30.30688
      ],
      [
        -89.32957,
        30.30454
      ],
      [
        -89.3324,
        30.30171
      ],
      [
        -89.33653,
        30.29852
      ],
      [
        -89.33952,
        30.29657
      ],
      [
        -89.34296,
        30.29478
      ],
      [
        -89.35037,
        30.29157
      ],
      [
        -89.3568,
        30.28987
      ],
      [
        -89.3596,
        30.28899
      ],
      [
        -89.36104,
        30.28823
      ],
      [
        -89.36596,
        30.28518
      ],
      [
        -89.36813,
        30.28335
      ],
      [
        -89.37055,
        30.28077
      ],
      [
        -89.37655,
        30.27357
      ],
      [
        -89.38039,
        30.2705
      ],
      [
        -89.38911,
        30.26544
      ],
      [
        -89.39047,
        30.26478
      ],
      [
        -89.39427,
        30.26328
      ],
      [
        -89.40082,
        30.26218
      ],
      [
        -89.40527,
        30.26049
      ],
      [
        -89.41368,
        30.2579
      ],
      [
        -89.41878,
        30.25491
      ],
      [
        -89.41983,
        30.25394
      ],
      [
        -89.42298,
        30.24959
      ],
      [
        -89.42387,
        30.24813
      ],
      [
        -89.42454,
        30.24663
      ],
      [
        -89.42541,
        30.24339
      ],
      [
        -89.42524,
        30.24181
      ],
      [
        -89.42535,
        30.24102
      ],
      [
        -89.42488,
        30.23868
      ]
    ],
    "elevation": [
      [
        0,
        0.2
      ],
      [
        0.125,
        0.218
      ],
      [
        0.25,
        0.26
      ],
      [
        0.375,
        0.302
      ],
      [
        0.5,
        0.32
      ],
      [
        0.625,
        0.302
      ],
      [
        0.75,
        0.26
      ],
      [
        0.875,
        0.218
      ],
      [
        1,
        0.2
      ]
    ]
  },
  "landmarks": [
    {
      "name": "Bay St. Louis",
      "model": "town-blocks",
      "at": 0.33642000408670814,
      "offset": "roadside",
      "notes": "Story moment 1; town. Projected coordinate, kept in driving order."
    },
    {
      "name": "Waveland",
      "model": "town-blocks",
      "at": 0.5774708195274545,
      "offset": "roadside",
      "notes": "Story moment 2; town. Projected coordinate, kept in driving order."
    }
  ],
  "dressing": [
    {
      "model": "sandbar",
      "at": 0.041666666666666664,
      "side": 1,
      "distance": 1.5,
      "scale": 1.4
    },
    {
      "model": "sandbar",
      "at": 0.2916666666666667,
      "side": 1,
      "distance": 1.5,
      "scale": 1.4
    },
    {
      "model": "sandbar",
      "at": 0.5416666666666666,
      "side": 1,
      "distance": 1.5,
      "scale": 1.4
    },
    {
      "model": "sandbar",
      "at": 0.7916666666666666,
      "side": 1,
      "distance": 1.5,
      "scale": 1.4
    }
  ],
  "towns": [
    {
      "name": "Bay St. Louis",
      "at": 0.33644067796610166,
      "landmark": "Bay St. Louis"
    },
    {
      "name": "Lakeshore",
      "at": 0.9661016949152542,
      "landmark": ""
    }
  ],
  "sources": [
    "content/stories/beach-boulevard-scenic-byway-81464.json",
    "public/data/strips/beach-boulevard-scenic-byway-81464.json",
    "public/data/byways.geojson",
    "public/data/catalog.json"
  ],
  "geometryNotes": "Strip main route, simplified to 56 bends. Elevation is a smooth illustrative scene profile, not surveyed heights. Terrain, vegetation and water are schematic; only editorial evidence authorizes landmarks."
}
