{
  "authored": false,
  "bywayId": "route-101-redwood-highway-2198",
  "title": "Route 101--Redwood Highway",
  "longitude": -124.1149,
  "ground": "coastal-cliff",
  "palette": "coast",
  "snowInWinter": false,
  "road": {
    "shape": "from-geometry",
    "profile": "cliff-shelf",
    "lanes": 2,
    "coordinates": [
      [
        -124.14305,
        41.72871
      ],
      [
        -124.1412,
        41.72511
      ],
      [
        -124.13928,
        41.72341
      ],
      [
        -124.13577,
        41.71612
      ],
      [
        -124.13536,
        41.7144
      ],
      [
        -124.13049,
        41.7131
      ],
      [
        -124.12922,
        41.71146
      ],
      [
        -124.12701,
        41.71084
      ],
      [
        -124.12727,
        41.70985
      ],
      [
        -124.13009,
        41.70926
      ],
      [
        -124.13139,
        41.70857
      ],
      [
        -124.13146,
        41.70789
      ],
      [
        -124.13044,
        41.70632
      ],
      [
        -124.12614,
        41.70536
      ],
      [
        -124.12172,
        41.70116
      ],
      [
        -124.11937,
        41.69724
      ],
      [
        -124.11783,
        41.6957
      ],
      [
        -124.10929,
        41.69262
      ],
      [
        -124.10746,
        41.6915
      ],
      [
        -124.10644,
        41.69031
      ],
      [
        -124.10693,
        41.68574
      ],
      [
        -124.10788,
        41.685
      ],
      [
        -124.11298,
        41.6837
      ],
      [
        -124.11362,
        41.68308
      ],
      [
        -124.11393,
        41.68191
      ],
      [
        -124.11393,
        41.68021
      ],
      [
        -124.11285,
        41.67742
      ],
      [
        -124.11384,
        41.67374
      ],
      [
        -124.11295,
        41.6661
      ],
      [
        -124.11562,
        41.66238
      ],
      [
        -124.11633,
        41.65989
      ],
      [
        -124.11545,
        41.65789
      ],
      [
        -124.11593,
        41.65524
      ],
      [
        -124.11577,
        41.65325
      ],
      [
        -124.11446,
        41.64948
      ],
      [
        -124.11233,
        41.64706
      ],
      [
        -124.11554,
        41.64219
      ],
      [
        -124.11535,
        41.63844
      ],
      [
        -124.11496,
        41.63748
      ],
      [
        -124.11567,
        41.63409
      ],
      [
        -124.11253,
        41.63018
      ],
      [
        -124.11241,
        41.62644
      ],
      [
        -124.11106,
        41.62346
      ],
      [
        -124.10971,
        41.62169
      ],
      [
        -124.1092,
        41.61763
      ],
      [
        -124.10632,
        41.61537
      ],
      [
        -124.10542,
        41.61148
      ],
      [
        -124.10292,
        41.60637
      ],
      [
        -124.10014,
        41.60347
      ],
      [
        -124.10002,
        41.60194
      ],
      [
        -124.10104,
        41.59668
      ],
      [
        -124.10078,
        41.59581
      ],
      [
        -124.09757,
        41.59329
      ],
      [
        -124.09544,
        41.5898
      ],
      [
        -124.09176,
        41.58569
      ],
      [
        -124.08918,
        41.58464
      ]
    ],
    "elevation": [
      [
        0,
        0.85
      ],
      [
        0.125,
        0.894
      ],
      [
        0.25,
        1
      ],
      [
        0.375,
        1.106
      ],
      [
        0.5,
        1.15
      ],
      [
        0.625,
        1.106
      ],
      [
        0.75,
        1
      ],
      [
        0.875,
        0.894
      ],
      [
        1,
        0.85
      ]
    ]
  },
  "landmarks": [],
  "dressing": [
    {
      "model": "hardwood",
      "at": 0.0875,
      "side": -1,
      "distance": 0.8,
      "scale": 1.05
    },
    {
      "model": "hardwood",
      "at": 0.09949999999999999,
      "side": -1,
      "distance": 1.15,
      "scale": 1.05
    },
    {
      "model": "hardwood",
      "at": 0.11149999999999999,
      "side": -1,
      "distance": 1.5,
      "scale": 1.05
    },
    {
      "model": "hardwood",
      "at": 0.3375,
      "side": 1,
      "distance": 0.8,
      "scale": 1.05
    },
    {
      "model": "hardwood",
      "at": 0.34950000000000003,
      "side": 1,
      "distance": 1.15,
      "scale": 1.05
    },
    {
      "model": "hardwood",
      "at": 0.36150000000000004,
      "side": 1,
      "distance": 1.5,
      "scale": 1.05
    },
    {
      "model": "hardwood",
      "at": 0.5875,
      "side": -1,
      "distance": 0.8,
      "scale": 1.05
    },
    {
      "model": "hardwood",
      "at": 0.5995,
      "side": -1,
      "distance": 1.15,
      "scale": 1.05
    },
    {
      "model": "hardwood",
      "at": 0.6115,
      "side": -1,
      "distance": 1.5,
      "scale": 1.05
    },
    {
      "model": "hardwood",
      "at": 0.8375,
      "side": 1,
      "distance": 0.8,
      "scale": 1.05
    },
    {
      "model": "hardwood",
      "at": 0.8495,
      "side": 1,
      "distance": 1.15,
      "scale": 1.05
    },
    {
      "model": "hardwood",
      "at": 0.8615,
      "side": 1,
      "distance": 1.5,
      "scale": 1.05
    }
  ],
  "towns": [
    {
      "name": "Crescent Beach Overlook",
      "at": 0.16416666666666666,
      "landmark": ""
    },
    {
      "name": "Footsteps Rocks",
      "at": 0.7791666666666667,
      "landmark": ""
    }
  ],
  "sources": [
    "content/stories/route-101-redwood-highway-2198.json",
    "public/data/strips/route-101-redwood-highway-2198.json",
    "public/data/byways.geojson",
    "public/data/catalog.json"
  ],
  "geometryNotes": "Strip main route, simplified to 56 bends. Elevation is a smooth illustrative scene profile, not surveyed heights. Terrain, vegetation and water are schematic; only editorial evidence authorizes landmarks."
}
