{
  "authored": false,
  "bywayId": "interstate-26-scenic-highway-81459",
  "title": "Interstate 26 Scenic Highway",
  "longitude": -82.5439,
  "ground": "prairie-grid",
  "palette": "prairie",
  "snowInWinter": false,
  "road": {
    "shape": "from-geometry",
    "profile": "level",
    "lanes": 2,
    "coordinates": [
      [
        -82.5227,
        35.8395
      ],
      [
        -82.5239,
        35.846
      ],
      [
        -82.5287,
        35.8527
      ],
      [
        -82.532,
        35.862
      ],
      [
        -82.5382,
        35.8708
      ],
      [
        -82.5498,
        35.8812
      ],
      [
        -82.5496,
        35.8843
      ],
      [
        -82.5442,
        35.8914
      ],
      [
        -82.5436,
        35.896
      ],
      [
        -82.5463,
        35.9012
      ],
      [
        -82.5568,
        35.9078
      ],
      [
        -82.5581,
        35.9098
      ],
      [
        -82.556,
        35.9303
      ],
      [
        -82.5646,
        35.9459
      ],
      [
        -82.5603,
        35.9545
      ]
    ],
    "elevation": [
      [
        0,
        0.2
      ],
      [
        0.125,
        0.218
      ],
      [
        0.25,
        0.26
      ],
      [
        0.375,
        0.302
      ],
      [
        0.5,
        0.32
      ],
      [
        0.625,
        0.302
      ],
      [
        0.75,
        0.26
      ],
      [
        0.875,
        0.218
      ],
      [
        1,
        0.2
      ]
    ]
  },
  "landmarks": [],
  "dressing": [
    {
      "model": "field",
      "at": 0.041666666666666664,
      "side": -1,
      "distance": 1.3,
      "scale": 1.3
    },
    {
      "model": "hardwood",
      "at": 0.041666666666666664,
      "side": -1,
      "distance": 1.9,
      "scale": 0.8
    },
    {
      "model": "field",
      "at": 0.125,
      "side": 1,
      "distance": 1.3,
      "scale": 1.3
    },
    {
      "model": "field",
      "at": 0.20833333333333334,
      "side": -1,
      "distance": 1.3,
      "scale": 1.3
    },
    {
      "model": "field",
      "at": 0.2916666666666667,
      "side": 1,
      "distance": 1.3,
      "scale": 1.3
    },
    {
      "model": "hardwood",
      "at": 0.2916666666666667,
      "side": 1,
      "distance": 1.9,
      "scale": 0.8
    },
    {
      "model": "field",
      "at": 0.375,
      "side": -1,
      "distance": 1.3,
      "scale": 1.3
    },
    {
      "model": "field",
      "at": 0.4583333333333333,
      "side": 1,
      "distance": 1.3,
      "scale": 1.3
    },
    {
      "model": "field",
      "at": 0.5416666666666666,
      "side": -1,
      "distance": 1.3,
      "scale": 1.3
    },
    {
      "model": "hardwood",
      "at": 0.5416666666666666,
      "side": -1,
      "distance": 1.9,
      "scale": 0.8
    },
    {
      "model": "field",
      "at": 0.625,
      "side": 1,
      "distance": 1.3,
      "scale": 1.3
    },
    {
      "model": "field",
      "at": 0.7083333333333334,
      "side": -1,
      "distance": 1.3,
      "scale": 1.3
    },
    {
      "model": "field",
      "at": 0.7916666666666666,
      "side": 1,
      "distance": 1.3,
      "scale": 1.3
    },
    {
      "model": "hardwood",
      "at": 0.7916666666666666,
      "side": 1,
      "distance": 1.9,
      "scale": 0.8
    },
    {
      "model": "field",
      "at": 0.875,
      "side": -1,
      "distance": 1.3,
      "scale": 1.3
    },
    {
      "model": "field",
      "at": 0.9583333333333334,
      "side": 1,
      "distance": 1.3,
      "scale": 1.3
    }
  ],
  "towns": [],
  "sources": [
    "public/data/byways.geojson",
    "public/data/catalog.json"
  ],
  "geometryNotes": "Longest connected mapped chain; disconnected branches omitted, simplified to 56 bends. Elevation is a smooth illustrative scene profile, not surveyed heights. Terrain, vegetation and water are schematic; only editorial evidence authorizes landmarks."
}
