{
  "authored": false,
  "bywayId": "loup-rivers-scenic-byway-16473",
  "title": "Loup Rivers Scenic Byway",
  "longitude": -98.9767,
  "ground": "river-valley",
  "palette": "river",
  "snowInWinter": false,
  "road": {
    "shape": "from-geometry",
    "profile": "valley-floor",
    "lanes": 2,
    "coordinates": [
      [
        -100.10248,
        41.83283
      ],
      [
        -100.07295,
        41.83406
      ],
      [
        -100.05884,
        41.83913
      ],
      [
        -100.04516,
        41.85287
      ],
      [
        -100.03952,
        41.86315
      ],
      [
        -100.0172,
        41.88244
      ],
      [
        -99.96731,
        41.91218
      ],
      [
        -99.95137,
        41.91859
      ],
      [
        -99.85683,
        41.93221
      ],
      [
        -99.80147,
        41.90685
      ],
      [
        -99.66627,
        41.9071
      ],
      [
        -99.63861,
        41.8975
      ],
      [
        -99.57358,
        41.84349
      ],
      [
        -99.55464,
        41.83255
      ],
      [
        -99.51565,
        41.8246
      ],
      [
        -99.48865,
        41.81438
      ],
      [
        -99.47416,
        41.79712
      ],
      [
        -99.47194,
        41.77665
      ],
      [
        -99.46595,
        41.77073
      ],
      [
        -99.37971,
        41.77025
      ],
      [
        -99.37811,
        41.75573
      ],
      [
        -99.28752,
        41.75382
      ],
      [
        -99.23947,
        41.75871
      ],
      [
        -99.22314,
        41.76916
      ],
      [
        -99.1259,
        41.76953
      ],
      [
        -99.00971,
        41.68453
      ],
      [
        -98.94488,
        41.62142
      ],
      [
        -98.9436,
        41.60323
      ],
      [
        -98.9269,
        41.60301
      ],
      [
        -98.92528,
        41.59541
      ],
      [
        -98.91353,
        41.59471
      ],
      [
        -98.86521,
        41.57565
      ],
      [
        -98.83211,
        41.57438
      ],
      [
        -98.79756,
        41.55429
      ],
      [
        -98.78739,
        41.54474
      ],
      [
        -98.78023,
        41.52673
      ],
      [
        -98.77979,
        41.49574
      ],
      [
        -98.76431,
        41.49482
      ],
      [
        -98.71996,
        41.45826
      ],
      [
        -98.70202,
        41.43478
      ],
      [
        -98.68192,
        41.41834
      ],
      [
        -98.67725,
        41.40355
      ],
      [
        -98.65054,
        41.37874
      ],
      [
        -98.57548,
        41.29594
      ],
      [
        -98.56932,
        41.27956
      ],
      [
        -98.55506,
        41.27016
      ],
      [
        -98.55702,
        41.13255
      ],
      [
        -98.55293,
        41.12274
      ],
      [
        -98.55269,
        41.10865
      ],
      [
        -98.55932,
        41.09824
      ],
      [
        -98.57424,
        41.08638
      ],
      [
        -98.59771,
        41.07605
      ],
      [
        -98.6139,
        41.07593
      ],
      [
        -98.61387,
        41.04589
      ],
      [
        -98.60741,
        41.03538
      ],
      [
        -98.60741,
        40.81806
      ]
    ],
    "elevation": [
      [
        0,
        0.2
      ],
      [
        0.125,
        0.218
      ],
      [
        0.25,
        0.26
      ],
      [
        0.375,
        0.302
      ],
      [
        0.5,
        0.32
      ],
      [
        0.625,
        0.302
      ],
      [
        0.75,
        0.26
      ],
      [
        0.875,
        0.218
      ],
      [
        1,
        0.2
      ]
    ]
  },
  "landmarks": [],
  "dressing": [
    {
      "model": "river",
      "at": 0.5,
      "side": 1,
      "distance": 0.8,
      "scale": 1
    }
  ],
  "towns": [
    {
      "name": "Dunning",
      "at": 0,
      "landmark": ""
    },
    {
      "name": "Brewster",
      "at": 0.10581560283687944,
      "landmark": ""
    },
    {
      "name": "Almeria",
      "at": 0.24936170212765954,
      "landmark": ""
    },
    {
      "name": "Taylor",
      "at": 0.3176595744680851,
      "landmark": ""
    },
    {
      "name": "Burwell",
      "at": 0.41723404255319146,
      "landmark": ""
    },
    {
      "name": "Ord",
      "at": 0.5412765957446808,
      "landmark": ""
    },
    {
      "name": "North Loup",
      "at": 0.6238297872340425,
      "landmark": ""
    },
    {
      "name": "Elba",
      "at": 0.7539007092198582,
      "landmark": ""
    },
    {
      "name": "Dannebrog",
      "at": 0.8382978723404255,
      "landmark": ""
    },
    {
      "name": "Cairo",
      "at": 0.9083687943262412,
      "landmark": ""
    }
  ],
  "sources": [
    "public/data/strips/loup-rivers-scenic-byway-16473.json",
    "public/data/byways.geojson",
    "public/data/catalog.json"
  ],
  "geometryNotes": "Strip main route, simplified to 56 bends. Elevation is a smooth illustrative scene profile, not surveyed heights. Terrain, vegetation and water are schematic; only editorial evidence authorizes landmarks."
}
