{
  "authored": false,
  "bywayId": "warren-county-piedmont-scenic-byway-extension-72977",
  "title": "Warren County-Piedmont Scenic Byway Extension",
  "longitude": -82.7224,
  "ground": "river-valley",
  "palette": "river",
  "snowInWinter": false,
  "road": {
    "shape": "from-geometry",
    "profile": "valley-floor",
    "lanes": 2,
    "coordinates": [
      [
        -82.78478,
        33.29503
      ],
      [
        -82.77519,
        33.29625
      ],
      [
        -82.77472,
        33.2963
      ],
      [
        -82.77425,
        33.29629
      ],
      [
        -82.77353,
        33.29621
      ],
      [
        -82.77265,
        33.29601
      ],
      [
        -82.7709,
        33.29551
      ],
      [
        -82.76639,
        33.29433
      ],
      [
        -82.76596,
        33.29424
      ],
      [
        -82.76488,
        33.29418
      ],
      [
        -82.76421,
        33.29427
      ],
      [
        -82.76353,
        33.29442
      ],
      [
        -82.7513,
        33.29745
      ],
      [
        -82.75036,
        33.29772
      ],
      [
        -82.74989,
        33.2979
      ],
      [
        -82.7492,
        33.29827
      ],
      [
        -82.74835,
        33.29888
      ],
      [
        -82.7464,
        33.30089
      ],
      [
        -82.74544,
        33.302
      ],
      [
        -82.7439,
        33.30408
      ],
      [
        -82.74247,
        33.30634
      ],
      [
        -82.74062,
        33.30949
      ],
      [
        -82.73978,
        33.31119
      ],
      [
        -82.73442,
        33.32412
      ],
      [
        -82.73389,
        33.32508
      ],
      [
        -82.73289,
        33.32631
      ],
      [
        -82.72656,
        33.33193
      ],
      [
        -82.72602,
        33.33252
      ],
      [
        -82.72565,
        33.33306
      ],
      [
        -82.72523,
        33.33396
      ],
      [
        -82.72363,
        33.34041
      ],
      [
        -82.72306,
        33.34263
      ],
      [
        -82.72283,
        33.34332
      ],
      [
        -82.72259,
        33.34383
      ],
      [
        -82.72188,
        33.34497
      ],
      [
        -82.71808,
        33.35037
      ],
      [
        -82.71757,
        33.35099
      ],
      [
        -82.71688,
        33.35172
      ],
      [
        -82.71568,
        33.35282
      ],
      [
        -82.71206,
        33.35573
      ],
      [
        -82.70182,
        33.36381
      ],
      [
        -82.70056,
        33.36495
      ],
      [
        -82.69928,
        33.36637
      ],
      [
        -82.69066,
        33.3769
      ],
      [
        -82.68959,
        33.37791
      ],
      [
        -82.68263,
        33.3837
      ],
      [
        -82.68221,
        33.38417
      ],
      [
        -82.68159,
        33.38518
      ],
      [
        -82.67998,
        33.39
      ],
      [
        -82.67977,
        33.39046
      ],
      [
        -82.67926,
        33.39128
      ],
      [
        -82.67564,
        33.39598
      ],
      [
        -82.66765,
        33.4061
      ],
      [
        -82.6672,
        33.40654
      ],
      [
        -82.66656,
        33.40691
      ],
      [
        -82.662,
        33.407
      ]
    ],
    "elevation": [
      [
        0,
        0.2
      ],
      [
        0.125,
        0.218
      ],
      [
        0.25,
        0.26
      ],
      [
        0.375,
        0.302
      ],
      [
        0.5,
        0.32
      ],
      [
        0.625,
        0.302
      ],
      [
        0.75,
        0.26
      ],
      [
        0.875,
        0.218
      ],
      [
        1,
        0.2
      ]
    ]
  },
  "landmarks": [
    {
      "name": "Jewell",
      "model": "town-blocks",
      "at": 0.0389477296600091,
      "offset": "roadside",
      "notes": "Story moment 1; town. Projected coordinate, kept in driving order."
    },
    {
      "name": "Beall Springs",
      "model": "town-blocks",
      "at": 0.3055451491500557,
      "offset": "roadside",
      "notes": "Story moment 2; town. Projected coordinate, kept in driving order."
    },
    {
      "name": "Warrenton",
      "model": "town-blocks",
      "at": 0.996141726651286,
      "offset": "roadside",
      "notes": "Story moment 3; town. Projected coordinate, kept in driving order."
    }
  ],
  "dressing": [
    {
      "model": "ridge",
      "at": 0.5,
      "side": -1,
      "distance": 1.4,
      "scale": 1.5
    },
    {
      "model": "river",
      "at": 0.5,
      "side": 1,
      "distance": 0.8,
      "scale": 1
    }
  ],
  "towns": [
    {
      "name": "Jewell",
      "at": 0.039473684210526314,
      "landmark": "Jewell"
    },
    {
      "name": "Beall Springs",
      "at": 0.30701754385964913,
      "landmark": "Beall Springs"
    },
    {
      "name": "Warrenton",
      "at": 1,
      "landmark": "Warrenton"
    }
  ],
  "sources": [
    "content/stories/warren-county-piedmont-scenic-byway-extension-72977.json",
    "public/data/strips/warren-county-piedmont-scenic-byway-extension-72977.json",
    "public/data/byways.geojson",
    "public/data/catalog.json"
  ],
  "geometryNotes": "Strip main route, simplified to 56 bends. Elevation is a smooth illustrative scene profile, not surveyed heights. Terrain, vegetation and water are schematic; only editorial evidence authorizes landmarks."
}
